{
  "formatVersion": "1.0",
  "universe": {
    "id": "clickhouse-universe-small",
    "name": "Demo ClickHouse Universe",
    "description": "Deterministic static ClickHouse lineage graph",
    "generatedAt": "2026-07-26T00:00:00Z",
    "layoutSeed": 42042
  },
  "schemas": [
    {
      "id": "schema.s00",
      "name": "domain_00",
      "displayName": "Raw Intake",
      "owner": "Core Data",
      "tags": [
        "gold"
      ]
    },
    {
      "id": "schema.s01",
      "name": "domain_01",
      "displayName": "Analytics",
      "owner": "Analytics Engineering",
      "tags": [
        "silver"
      ]
    },
    {
      "id": "schema.s02",
      "name": "domain_02",
      "displayName": "Finance",
      "owner": "Finance Platform",
      "tags": [
        "hourly"
      ]
    },
    {
      "id": "schema.s03",
      "name": "domain_03",
      "displayName": "Operations",
      "owner": "Growth",
      "tags": [
        "realtime"
      ]
    },
    {
      "id": "schema.s04",
      "name": "domain_04",
      "displayName": "Growth",
      "owner": "Operations",
      "tags": [
        "pii"
      ]
    },
    {
      "id": "schema.s05",
      "name": "domain_05",
      "displayName": "Serving",
      "owner": "Core Data",
      "tags": [
        "events"
      ]
    }
  ],
  "nodes": [
    {
      "id": "node.s00.object_0000",
      "schemaId": "schema.s00",
      "name": "object_0000",
      "qualifiedName": "domain_00.object_0000",
      "kind": "special_table",
      "description": "Deterministic special table for lineage exploration",
      "owner": "Core Data",
      "tags": [
        "gold",
        "silver"
      ],
      "metrics": {
        "freshnessMinutes": 0
      },
      "table": {
        "engine": "TinyLog",
        "engineFamily": "Log",
        "hasOwnData": true,
        "size": {
          "bytes": 796394501599,
          "kind": "compressed",
          "scope": "unique",
          "isApproximate": true
        },
        "rows": 24659823521
      }
    },
    {
      "id": "node.s01.object_0001",
      "schemaId": "schema.s01",
      "name": "object_0001",
      "qualifiedName": "domain_01.object_0001",
      "kind": "table",
      "description": "Deterministic table for lineage exploration",
      "owner": "Analytics Engineering",
      "tags": [
        "silver",
        "pii"
      ],
      "metrics": {
        "freshnessMinutes": 1
      },
      "table": {
        "engine": "TinyLog",
        "engineFamily": "Log",
        "hasOwnData": true,
        "size": {
          "bytes": 57934890246,
          "kind": "compressed",
          "scope": "unique",
          "isApproximate": false
        },
        "rows": 297416329
      }
    },
    {
      "id": "node.s02.object_0002",
      "schemaId": "schema.s02",
      "name": "object_0002",
      "qualifiedName": "domain_02.object_0002",
      "kind": "table",
      "description": "Deterministic table for lineage exploration",
      "owner": "Finance Platform",
      "tags": [
        "hourly",
        "ops"
      ],
      "metrics": {
        "freshnessMinutes": 2
      },
      "table": {
        "engine": "S3",
        "engineFamily": "Integration",
        "hasOwnData": true,
        "size": {
          "bytes": 1672321,
          "kind": "compressed",
          "scope": "unique",
          "isApproximate": false
        },
        "rows": 39229
      }
    },
    {
      "id": "node.s03.object_0003",
      "schemaId": "schema.s03",
      "name": "object_0003",
      "qualifiedName": "domain_03.object_0003",
      "kind": "table",
      "description": "Deterministic table for lineage exploration",
      "owner": "Growth",
      "tags": [
        "realtime",
        "hourly"
      ],
      "metrics": {
        "freshnessMinutes": 3
      },
      "table": {
        "engine": "Kafka",
        "engineFamily": "Integration",
        "hasOwnData": true,
        "size": {
          "bytes": 197931947797842,
          "kind": "compressed",
          "scope": "unique",
          "isApproximate": false
        },
        "rows": 2064929694574
      }
    },
    {
      "id": "node.s04.object_0004",
      "schemaId": "schema.s04",
      "name": "object_0004",
      "qualifiedName": "domain_04.object_0004",
      "kind": "table",
      "description": "Deterministic table for lineage exploration",
      "owner": "Operations",
      "tags": [
        "pii",
        "events"
      ],
      "metrics": {
        "freshnessMinutes": 4
      },
      "table": {
        "engine": "Memory",
        "engineFamily": "Memory",
        "hasOwnData": true,
        "size": {
          "bytes": 399218786443672,
          "kind": "compressed",
          "scope": "unique",
          "isApproximate": false
        },
        "rows": 3772839066985
      }
    },
    {
      "id": "node.s05.object_0005",
      "schemaId": "schema.s05",
      "name": "object_0005",
      "qualifiedName": "domain_05.object_0005",
      "kind": "table",
      "description": "Deterministic table for lineage exploration",
      "owner": "Core Data",
      "tags": [
        "events",
        "gold"
      ],
      "metrics": {
        "freshnessMinutes": 5
      },
      "table": {
        "engine": "Kafka",
        "engineFamily": "Integration",
        "hasOwnData": true,
        "size": {
          "bytes": 2467228,
          "kind": "compressed",
          "scope": "unique",
          "isApproximate": false
        },
        "rows": 101285
      }
    },
    {
      "id": "node.s00.object_0006",
      "schemaId": "schema.s00",
      "name": "object_0006",
      "qualifiedName": "domain_00.object_0006",
      "kind": "table",
      "description": "Deterministic table for lineage exploration",
      "owner": "Analytics Engineering",
      "tags": [
        "finance",
        "realtime"
      ],
      "metrics": {
        "freshnessMinutes": 6
      },
      "table": {
        "engine": "S3",
        "engineFamily": "Integration",
        "hasOwnData": true,
        "size": {
          "bytes": 417098299,
          "kind": "compressed",
          "scope": "unique",
          "isApproximate": false
        },
        "rows": 19430537
      }
    },
    {
      "id": "node.s01.object_0007",
      "schemaId": "schema.s01",
      "name": "object_0007",
      "qualifiedName": "domain_01.object_0007",
      "kind": "table",
      "description": "Deterministic table for lineage exploration",
      "owner": "Finance Platform",
      "tags": [
        "ops",
        "finance"
      ],
      "metrics": {
        "freshnessMinutes": 7
      },
      "table": {
        "engine": "Kafka",
        "engineFamily": "Integration",
        "hasOwnData": true,
        "size": {
          "bytes": 8909654,
          "kind": "compressed",
          "scope": "unique",
          "isApproximate": true
        },
        "rows": 47993
      }
    },
    {
      "id": "node.s02.object_0008",
      "schemaId": "schema.s02",
      "name": "object_0008",
      "qualifiedName": "domain_02.object_0008",
      "kind": "table",
      "description": "Deterministic table for lineage exploration",
      "owner": "Growth",
      "tags": [
        "gold",
        "silver"
      ],
      "metrics": {
        "freshnessMinutes": 8
      },
      "table": {
        "engine": "ReplicatedMergeTree",
        "engineFamily": "MergeTree",
        "hasOwnData": true,
        "size": {
          "bytes": 51462970,
          "kind": "compressed",
          "scope": "unique",
          "isApproximate": false
        },
        "rows": 313226
      }
    },
    {
      "id": "node.s03.object_0009",
      "schemaId": "schema.s03",
      "name": "object_0009",
      "qualifiedName": "domain_03.object_0009",
      "kind": "table",
      "description": "Deterministic table for lineage exploration",
      "owner": "Operations",
      "tags": [
        "silver",
        "pii"
      ],
      "metrics": {
        "freshnessMinutes": 9
      },
      "table": {
        "engine": "S3",
        "engineFamily": "Integration",
        "hasOwnData": true,
        "size": {
          "bytes": 58617425431276,
          "kind": "compressed",
          "scope": "unique",
          "isApproximate": false
        },
        "rows": 751307025529
      }
    },
    {
      "id": "node.s04.object_0010",
      "schemaId": "schema.s04",
      "name": "object_0010",
      "qualifiedName": "domain_04.object_0010",
      "kind": "table",
      "description": "Deterministic table for lineage exploration",
      "owner": "Core Data",
      "tags": [
        "hourly",
        "ops"
      ],
      "metrics": {
        "freshnessMinutes": 10
      },
      "table": {
        "engine": "ReplicatedMergeTree",
        "engineFamily": "MergeTree",
        "hasOwnData": true,
        "size": {
          "bytes": 1451430,
          "kind": "compressed",
          "scope": "unique",
          "isApproximate": false
        },
        "rows": 9585
      }
    },
    {
      "id": "node.s05.object_0011",
      "schemaId": "schema.s05",
      "name": "object_0011",
      "qualifiedName": "domain_05.object_0011",
      "kind": "table",
      "description": "Deterministic table for lineage exploration",
      "owner": "Analytics Engineering",
      "tags": [
        "realtime",
        "hourly"
      ],
      "metrics": {
        "freshnessMinutes": 11
      },
      "table": {
        "engine": "ReplicatedMergeTree",
        "engineFamily": "MergeTree",
        "hasOwnData": true,
        "size": {
          "bytes": 3532887761,
          "kind": "compressed",
          "scope": "unique",
          "isApproximate": false
        },
        "rows": 39924867
      }
    },
    {
      "id": "node.s00.object_0012",
      "schemaId": "schema.s00",
      "name": "object_0012",
      "qualifiedName": "domain_00.object_0012",
      "kind": "table",
      "description": "Deterministic table for lineage exploration",
      "owner": "Finance Platform",
      "tags": [